0,N/A,N/A,N/A,N/A,N/A,N/A,0,0,N/A,N/A,0,false,None,N/A,N/A
2006,Used,Subaru,Legacy,gt,Wagon,N/A,0,236000,Automatic,Gasoline,6000,false,"Includes: Sunroof, Alloy wheels, Cruise control, Air conditioning","up for sale is my 2006 legacy gt wagon. This car has been daily driven for it's lifetime, majority being highway kilometers, with the current odometer sitting at 236xxx km. It has received slight modifications to get to an OEM+ stage of performance. Engine mods consists of a grimmspeed catless up pipe, invidia catted downpipe, along with a dyno tune from Airboy tuning, yielding a total of 220 whp. Bilstein HD inverted dampers and Spec B springs are installed for suspension mods, along with Whiteline bushings and 20mm rear sway bar, this setup allows for an smooth and composed ride, especially minimizing the rear end hop when going through bumps. The interior is loaded with leather, with heated seats in the front, and dual zone automatic climate control. The plastic trim shows no sign of cracking or fading. The exterior has signs of highway driving, with one dent on the door and some visible scratches. The windshield is cracked but does not affect the view on the road. The car has received religious maintenance through its lifetime, with oil changes every 5000 to 6000 kilometers using shell rotella t6. Other major maintenance includes timing belt and water pump change @160k, new spark plugs @ 180k. Automatic transmission fluid, front control arms and bushings, front axles, 4 wheel bearings, new kirkland battery, napa blank rotors, stoptech pads and brake fluid flush, all done two years ago. The car comes with two sets of wheels and tires, shown in the pictures, and engine block heater. Priced at 6000, this is a perfect package for a daily driver.",https://www.kijiji.ca/v-cars-trucks/edmonton/2006-subaru-legacy-2-5-gt-wagon/1431662199
2007,Used,Dodge,Caliber,SXT,Wagon,Red,0,216833,Manual,N/A,2995,true,None,"Interested? Need more information? Contact our Internet sales team at 780-701-1338, or come on in ... ! South Side Mitsubishi is located at 9605 34 Ave NW, Edmonton, AB, right on the corner of 34 Ave and 97 Street ... you can't miss us! We are proud to serve Edmonton and the rest of Alberta. Southside Mitsubishi is an AMVIC Licensed Dealer Engine: Gas I4 1.8L/110 KIT REF ID: 17051876",https://www.kijiji.ca/v-cars-trucks/edmonton/2007-dodge-caliber-sxt/1429879007
1994,Used,Volvo,940,N/A,Wagon,Grey,7,177000,Automatic,Gasoline,2000,false,"Includes: Sunroof, Air conditioning",One 1994 Volvo 940 wagon Automatic Oil changed every 5000kms Needs muffler And alignment. Offers welcome Thank you and have a great day:),https://www.kijiji.ca/v-cars-trucks/edmonton/1994-volvo-940-turbo-wagon/1428165257
2000,Used,Subaru,Legacy,GTB,Wagon,Silver,5,122000,Manual,Gasoline,3500,false,"Includes: Alloy wheels, Air conditioning","Revision C, 5 speed manual, ej208 with 100k, fresh tires/alignment. Needs paintwork, brakes, windshield, and a MAF. Rotella and oem filter every 6k, new air filter, and new plugs. Selling as my freshly imported B4 just arrived. Can deliver to see/test drive, please call or text 780-974-6636, or email.",https://www.kijiji.ca/v-cars-trucks/st-albert/2000-subaru-legacy-gtb-rhd/1432253951
2001,Used,Chrysler,PT Cruiser,classic,Wagon,Green,5,211000,Automatic,N/A,1200,false,"Includes: Sunroof, Cruise control, Air conditioning",+ Remote Starter + Cruise Control +211K KM’s + New Battery + New Front Wheels - Needs Oil Change - Left Rear End was damaged,https://www.kijiji.ca/v-cars-trucks/edmonton/2001-pt-cruiser/1429710591
2002,Used,Subaru,Forester,Sport,Wagon,Red,5,374274,Manual,Gasoline,1800,false,"Includes: Sunroof, Cruise control, Air conditioning",2002 forest sport for sale. Clutch was done not even 2000km ago. Crankshaft seal New NGK Iridium plugs and NGK wires. Down stream o2 sensor was replaced last month. New rear pads and rotors Right front wheel bearing was done too Has a bit of a misfire and the U- joint is loose so is making noise. It also has a bit of rust over the wheel wells which is common. I'm asking 1800. I'd be open too look at trades too,https://www.kijiji.ca/v-cars-trucks/edmonton/2002-subaru-forester/1428456635
2008,Used,Ford,E-250,N/A,Wagon,Blue,2,220,Automatic,Gasoline,5390,false,Includes: Cruise control,Ford Econoline 250 .in perfect condition . Mechanical inspected . Take a look in the pictures .coming with shelves .insolated with all inside .keep warm in the winter . Low km . Is my work van .I am moving out the country . Call me at 780 802 2316 coming with vehicle information report .,https://www.kijiji.ca/v-cars-trucks/edmonton/work-van/1429567449
2007,Used,Mazda,5,GS,Wagon,Brown,7,198000,Automatic,Gasoline,3000,false,"Includes: Alloy wheels, Cruise control, Air conditioning",Good little car would be perfect for young family. All repairs needed have been done. Newer shocks/struts-brakes/rotors all around. Newer exhaust (1 year old) new tires last fall. Car is daily runner so KM'S will be increasing.,https://www.kijiji.ca/v-cars-trucks/st-albert/2007-mazda-5/1427339546
2003,Used,Subaru,Forester,N/A,Wagon,White,0,323000,Automatic,N/A,2350,false,None,"White 2003 Subaru Forester AWD. Reliable, well cared for vehicle with minor issues (don’t impact operation) and slight rusting. 323,000 km. Features: -automatic transmission -upgraded stereo system w/ bluetooth - winter and summer tires included (summer tires are less than 2 years old) - all wheel drive - spacious trunk - 2 sets of floor mats - non-smoking vehicle - no collisions Contact Keira at keiranystrom@gmail.com or 780-966-9762. Text or email preferred.",https://www.kijiji.ca/v-cars-trucks/edmonton/2003-subaru-forester-awd/1429559009
2007,Used,Kia,Rondo,EX/ 6 MONTHS WARRANTY INCLUDED.,Wagon,Blue,0,204850,Automatic,N/A,4499,true,None,"Discount Auto Credit Mechanical Fitness Assessment and Carproof available. At Discount Auto Credit we specialize in rebuilding your credit. We believe that saving you money can go a long way, in addition to that we strive to find you the right vehicle that fits your budget and needs. Quick & Easy Financing! No SIN # Required. Refinance your current loan with lower rates O.A.C. For Fast Approval Call : 780-7578723 or email: Auto@discountautocredit.com To Get Started Right Away! We Also Have Many Options For Credit Rebuilding older or newer vehicles. Start now with our secure online credit Application: https://www.discountautocredit.com/car-loan-application AMVIC Licensed Dealer We are very happy to help you. Engine: 4 Cylinder KIT REF ID: 14441731",https://www.kijiji.ca/v-cars-trucks/edmonton/2007-kia-rondo-ex-6-months-warranty-included/1400623719
2002,Used,Ford,Windstar,N/A,Wagon,Grey,7,111000,Automatic,Gasoline,3200,false,"Includes: Cruise control, Trailer hitch, Air conditioning",Has two sets of Ford wheels summer and winter will put new brakes before selling van is in excellent condition,https://www.kijiji.ca/v-cars-trucks/strathcona-county/for-sale/1429518835
2004,Used,Subaru,Forester,N/A,Wagon,Green,0,291000,Automatic,N/A,3000,false,None,"2004 Forrester XS AWD Wagon , 291K, automatic, good condition, no accidents, no issues. Little rust at rear wheel wells otherwise body excellent. Good tires. Call 780-433-4541",https://www.kijiji.ca/v-cars-trucks/edmonton/2004-subaru-forester-2-5xs4/1431476618
2000,Used,Subaru,Forester,sti,Wagon,Silver,5,191000,Automatic,Gasoline,5500,false,Includes: Air conditioning,"2000 jdm Forester sti trim Needs nothing maybe a windshield if you a try hard inspector. This car has been in my possession since it was imported has newer spark plugs and wires, Timing was done at rally @ 175,000. Extras I have done Cusco rear subframe brace Cusco 22mm rear sway Oem sti rear diffuser (02-07) Silicone y pipe Grimspeed manual boost controller(replaces old factory crusty lines) Boost gauge Blox mini muffler I drive it daily love it just need change 5500.00 or 7200 with the gram lights Prices are OBO May also be interested in some trades Honda/ older euro (bmw/Audi)",https://www.kijiji.ca/v-cars-trucks/edmonton/for-sale-2000-subaru-forester-sti-trim/1432238789
2007,Used,Mazda,Other,GT,Wagon,Grey,6,186280,Other,Gasoline,5200,false,"Includes: Sunroof, Cruise control, Air conditioning","Low km in good condition,No engine leaks,accident free leather interior, heated seats sun roof good on gas , with a remote starter, 2 original keys 2 extra all season tires,however it has a small rust at the rear back both sides but it’s minor",https://www.kijiji.ca/v-cars-trucks/edmonton/2007-mazda5/1428947220
1998,Used,Ford,Other,N/A,Wagon,Off-White,0,220000,Automatic,N/A,2100,false,None,1998 Ford cube van working good,https://www.kijiji.ca/v-cars-trucks/edmonton/1998-ford-cube-van/1427976177
2010,Used,Kia,Rondo,EX w/3rd Row,Wagon,Red,7,131000,Automatic,Gasoline,5500,false,"Includes: Alloy wheels, Bluetooth, Cruise control, Air conditioning","2010 kia rondo 7 passenger Automatic Active Carproof in hand 131,000kms All power options Heated seats Call or text for viewing",https://www.kijiji.ca/v-cars-trucks/edmonton/2010-kia-rondo-ex-7-passenger/1433073341
2006,Used,Dodge,Magnum,Sxt,Wagon,Silver,0,322000,Automatic,Gasoline,2000,false,None,"2006 Dodge Magnum sxt for sale. 3.5 l engine, higher mileage but good shape and lots of life left in it. Lots of new parts, new battery, new starter, tinted head and tail lights, comes with predator tuner. Clean car, reliable, will need lower ball joints done. Was my daily driver, only parked and selling due to upgrading to a pick up for work. Open to trades for a pickup or motorcycle. 2000 obo, no low balls, not in a rush to sell.",https://www.kijiji.ca/v-cars-trucks/edmonton/2006-dodge-magnum-sxt/1427645584
1985,Used,Chevrolet,Caprice,N/A,Wagon,N/A,0,0,N/A,N/A,1,false,None,"I’m looking for a Caprice or Regency Wagon, my grandpa had one when I was growing up and I’ve missed that cat ever since. So I’m looking to buy one, if you have anything along the lines of this please contact me. Would rather save it from being put in derby and lost forever.",https://www.kijiji.ca/v-cars-trucks/edmonton/iso-chevrolet-caprice-wagon-regency-wagon/1421397374
2009,Used,Subaru,Forester,N/A,Wagon,Green,5,160000,Automatic,N/A,3800,false,"Includes: Alloy wheels, Bluetooth, Cruise control, Air conditioning","Subaru Forester, clean, well maintained, AWD SUV. Great condition, has all scheduled maintenance done scheduled intervals and there is paperwork to show. Brake pads recently replaced and recently replaced all season tires. AWD makes it great for winter driving. No major accidents over 2000, there is a small dent on the driver side by the tail light, as well as a scratch on the front passenger side on the bumper but is just cosmetic in terms of damage. The vehicle was originally purchased in the states several years ago and is in miles therefore the Kms are ~264000 The windshield does have numerous chips and cracks and will need to be replaced. It is a reliable car, the reason for selling is because I'm looking to upgrade to a newer vehicle. If you have any questions or are interested in viewing the car call or text me at (780) 621-1011.",https://www.kijiji.ca/v-cars-trucks/edmonton/2009-subaru-forester-2-5-x-awd-well-maintained-great-condition/1433438415
2006,Used,Chevrolet,HHR,LT,Wagon,Black,5,295,Automatic,Gasoline,2200,false,"Includes: Sunroof, Alloy wheels, Cruise control, Air conditioning","Very nive clean car, this never gave me any problems . It's clean in and out, well taking care of. A little rust over the right rear wheel that all it has! Inside it's pretty clean, non Smoking car, i can't even stand the smell of cigarettes. Keyless entry, remote starter ,power windows and doors, sunroof . Oil change always on time, just brakes,wheel barings. When it needed something to be fixed, i got it fixed asap! Good car to use for next 3-5 years. Priced to sell ! $2200 obo 780-884-5548",https://www.kijiji.ca/v-cars-trucks/edmonton/chevy-hhr/1432784918
1994,Used,Jeep,Cherokee,Classic,Wagon,Blue,5,309484,Manual,Gasoline,1100,false,None,"Inline 6. 4.0L high output. Classic trim. 5 speed. No leaks. 4×4 works. Drives does not overheat. New starter. Pvc's brand new, just had spark plugs NGK and Wiring also just put in. No rips in the interior. Hatch needs a strut put in it's provided. Just had the seats shampooed. Surface rust not too deep or holes under the jeep. Oil changed month ago. Alberta active.",https://www.kijiji.ca/v-cars-trucks/edmonton/1994-jeep-cherokee/1424134043
1991,Used,Jeep,Cherokee,N/A,Wagon,Black,5,0,Automatic,Gasoline,1500,false,None,"1991 Jeep Cherokee this is a project vehicle and will be sold as is where is will need to be trailered. Comes with lots of new parts still in boxes. Drivetrain is in very good condition exterior is in good condition will need a good buffing, glass good, doors good, hatch good",https://www.kijiji.ca/v-cars-trucks/st-albert/1991-jeep-cherokee-limited-4l-h-o-project/1425802569
2009,Used,Volkswagen,Jetta,N/A,Wagon,N/A,0,230,N/A,N/A,5450,false,None,2009 jetta Tdi (diesel) 230km Automatic Alberta active Clean in/out Drive good Good brake Good tires Emissions recalls done in 2017 1000km with a full tank of fuel and you got lots of space. Welcome savings! 431-337-3222,https://www.kijiji.ca/v-cars-trucks/edmonton/2009-volkswagen-jetta-tdi-1000km-tank/1433121629
2000,Used,Ford,Focus,N/A,Wagon,N/A,0,296000,N/A,N/A,1000,false,None,"Runs well. Reliable vehicle. 296,000 Kms. Comes with extra set of rims and tires.",https://www.kijiji.ca/v-cars-trucks/edmonton/2000-ford-focus-wagon-extra-set-of-rims-and-tires-296-000-kms/1433427888
2019,Used,Toyota,Other,N/A,Wagon,Other,0,380,Other,Other,1655,false,Includes: Alloy wheels,Im selling my rays gramlight 57cr. Good as new. Don’t need it. And it has been displayed on the shop for a little while. And I badly needed cash. I used them for 380km ish. Highway roads. No dents scratches or anything. Unlimited check upon meet ups. Still covered by the warranty so if anything happens to u your safe. Asking price 1655 I can forward more pictures if necessary.,https://www.kijiji.ca/v-cars-trucks/edmonton/rays-gramlight-57cr/1432346565
2003,Used,Chrysler,PT Cruiser,Classic,Wagon,Blue,5,150000,Automatic,Gasoline,1000,false,"Includes: Cruise control, Air conditioning","Full load, air, tilt, cruise, and power windows and locks Needs water pump seal. New brakes, suspension bushings, bearings.",https://www.kijiji.ca/v-cars-trucks/edmonton/2003-pt-criuser/1429185588
2002,Used,Subaru,Forester,N/A,Wagon,Silver,5,330000,Manual,Gasoline,2800,false,"Includes: Alloy wheels, Bluetooth, Cruise control, Trailer hitch, Air conditioning","Selling my 2002 forester. It's been a great car for the 4 years I've owned it. Always kept up on regular maintenance. It also has quite a few aftermarket upgrades that I will list below. Kyb shocks with adjustable dampening Koni yellow lowering springs Whiteline swaybars Upgraded endlinks (can't remember brand) Unequal length header (for that subaru rumble) Custom exhaust with high flow cat Thermal Intake manifold spacers Double din touch screen head unit w/bluetooth 10" Subwoofer Recent maintenance (within 6 months) Complete engine refresh. Removed engine, disassembled, had heads checked to be true and had 1 bad valve guide fixed, Re assembled with all new gaskets and seals including valve stem seals. New clutch while engine was out New timing belt with new tensioner and idlers New front and rear Rotors and pads Radiator cracked and was replaced about 2 years ago otherwise the car has never broken down on us. The car comes on winter tires as pictured. Have a set of summer tires without wheels that I will include There is some rust around the rear wheel arches and on the tailgate. A/c was NOT recharged after motor was complete but did work before it was drained. Serious inquiries only please.",https://www.kijiji.ca/v-cars-trucks/edmonton/2002-subaru-forester/1430415210
2002,Used,Subaru,Forester,XT,Wagon,Black,5,138000,Automatic,N/A,5500,false,"Includes: Alloy wheels, Bluetooth, Air conditioning",Selling my RHD JDM Subaru Forester XT. First Canadian owner. Car is automatic AWD with 138xxxkm. Have brand new set of blizzak winters on it but still have the tires it came in on. Car has been parked for a month. Last registered and insured in Alberta. No Trades. 7809196177 text only,https://www.kijiji.ca/v-cars-trucks/edmonton/2002-rhd-subaru-forester-xt/1430062196
2000,Used,Subaru,Legacy,N/A,Wagon,N/A,0,192048,N/A,N/A,5000,false,None,"2000 Legacy GTB E-Tune Twin Turbo Wagon JDM RHD Auto Engine was rebuilt by James at City South Auto (James is a Subaru God). First Gear has done a boost leak test and alignment. Comes with wheels pictured with brand new winter tires that have under 200kms on them. New summer wheels with nitto motivo tires can be negotiated into the price. All gaskets, seals and multiple hoses have been replaced, Brakes are in amazing shape. Car is completely stock. Pioneer Headunit with 5 Kicker Speakers. Imported in 2015 and sold to an older lady that drove it out of town for work. Rebuilt Engine at 192,012kms (36 kms ago) Engine: Rebuilt Heads Resurfaced Heads Polished Cam Journals Gates Timing Belt Kit New Idlers/Pulleys New Water Pump New Valves New Fuel Pump Interior is in great condition with a rare blue leather interior. Paint is in great condition only 2 small dents and 1 scratch. Car is priced firm considering everythingthat has been done to it. Only negotiable with reasonable offers in person.",https://www.kijiji.ca/v-cars-trucks/edmonton/2000-legacy-gtb-e-tune-new-engine/1430653586
2006,Used,Chrysler,300-Series,N/A,Wagon,Grey,5,160000,Automatic,Gasoline,5000,false,"Includes: Sunroof, Alloy wheels, Navigation system, Bluetooth, Cruise control, Air conditioning",5.7l v8 hemi lather inside soonroof electric group summer tire run and drive perfect is limited edition double exhaust,https://www.kijiji.ca/v-cars-trucks/strathcona-county/chrysler-hemi-300/1432898823
1997,Used,Subaru,Impreza,N/A,Wagon,White,0,170000,Manual,Gasoline,4000,false,Includes: Sunroof,"Selling my 97 Subaru, this car has been well maintained and taken care of, no accidents and a clean history. Everything is stock except the exhaust which comes with a silencer as well. The car has no problems although it is recommended that the clutch be replaced. I can provide more pictures and information upon request. For fastest response text (780)915-4105",https://www.kijiji.ca/v-cars-trucks/edmonton/1997-subaru-impreza-wrx-gf8/1426044308
1988,Used,Volkswagen,Other,Gl,Wagon,Black,5,230000,Manual,Gasoline,2000,false,"Includes: Alloy wheels, Air conditioning","I am selling my two Volkswagen Fox's as I dont have the time to do the things I wanted to them. 2500 for both cars extra 1.8 disassembled and a 2.0T complete with ECU and wiring harness as well as spare 4 speed and extra 5 speed. As well as lots of extra new parts. 1988 wagon - Got it about two years ago in primer, and it wouldnt stay running on it's own. Since then iv replaced fuel tank and pump plus filter,spark plugs,wires, rear struts and springs, (springs are 60/40 lowering springs from mk2) fronts are not installed yet have shocks and new wheel bearings for the front. Have added a stereo as well as got a side pipe exhaust done in leduc at Tim's muffler, deleted the marker lights on the back of the car. Parked because of passenger side wheel bearing. Also starter sticks. 1990 coupe. Was daily driving this car up until I got my truck back replaced fuel pump and air intake boot from CISE injection pump to manifold. Also has good radio, wired for sub. Both cars speedos dont work.",https://www.kijiji.ca/v-cars-trucks/edmonton/both-foxs-2000/1430550960
2007,Used,Dodge,Caliber,SXT,Wagon,Yellow,5,158000,Other,Gasoline,3600,false,"Includes: Alloy wheels, Cruise control, Trailer hitch","I'm selling my Dodge Caliber with 158000km, fully equipped with brand new all season tires, brand new front wheel struts, oil just changed, as well as new windshield wipers. Has CD insert, automatic transmission, power locks, A/C and heating, cruise control and excellent on fuel and a very reliable vehicle altogether. Practically perfect condition with a recently cleaned interior, other than tiny rust damage on drivers side due to sliding off the highway a few months ago. Asking for $3600 or BEST OFFER. I'm moving into the city of Edmonton, and will no longer be needing a vehicle as the ETS will replace my ways of transportation for the time being. Serious interested buyers can contact me at 587-990-2122 or by email chrisrob.plmr@gmail.com Thanks!",https://www.kijiji.ca/v-cars-trucks/edmonton/2007-dodge-caliber/1425167688
2003,Used,BMW,X5,N/A,Wagon,Green,5,219000,Automatic,Gasoline,5600,false,"Includes: Cruise control, Air conditioning","Beautifully kept 2003 BMW X5, turquoise green in colour, tinted windows with grey leather interior. Mint shape, lady driven. Serious inquiries only please",https://www.kijiji.ca/v-cars-trucks/edmonton/2003-bmw-x5/1433232201
2006,Used,Pontiac,Vibe,N/A,Wagon,Red,5,194779,Automatic,Gasoline,4500,false,"Includes: Alloy wheels, Parking assistant, Trailer hitch, Air conditioning","2006 Pontiac Vibe for sale by owner in Edmonton, Automatic, good condition of interior and exterior. I’m just selling this amazing car because of I’m moving to other province. If you interested text or call me. Cell 7808025743",https://www.kijiji.ca/v-cars-trucks/edmonton/2006-pontiac-vibe-automatic-for-sale-by-owner/1432897912
2005,Used,Dodge,Magnum,N/A,Wagon,White,0,170000,Automatic,Gasoline,3500,false,None,2005 magnum rwd v6 170k no major issues needs tires this summer otherwise runs good Minor scrapes and dings,https://www.kijiji.ca/v-cars-trucks/st-albert/2005-dodge-magnum-need-gone/1423327239
2002,Used,Subaru,Outback,AWD,Wagon,Green,5,185000,Automatic,Gasoline,3900,true,"Includes: Alloy wheels, Cruise control, Air conditioning",VEHICLE OPTIONS: Power locks Power mirrors Power steering Remote keyless entry Tilt wheel Power windows Rear window defroster Rear window wiper CD player Bucket seats Heated seats Airbag: driver Anti-lock brakes Roof rack CARPROOF,https://www.kijiji.ca/v-cars-trucks/edmonton/2002-subaru-outback-awd-wagon/1433236627
2006,Used,Chrysler,PT Cruiser,N/A,Wagon,Blue,5,193900,Automatic,Gasoline,2800,false,"Includes: Sunroof, Air conditioning","I am selling my 2006 PT cruiser for $2800, everything works well, no any issues, want to sell it ASAP. the price is not firm, I am selling it because I wanna buy a bigger car, also can trade for car",https://www.kijiji.ca/v-cars-trucks/edmonton/selling-a-chrysler-pt-cruiser-for-2800-the-price-is-not-firm/1431012214
2005,Used,Ford,Taurus,SEL,Wagon,Black,0,128779,Automatic,Gasoline,4900,false,"Includes: Sunroof, Cruise control, Air conditioning","Posting for my family, you can reach them at 780-963-4229. Car is in fantastic condition. 128779kms.",https://www.kijiji.ca/v-cars-trucks/edmonton/2005-ford-taurus-wagon/1430547808
2002,Used,Subaru,Impreza,WRX Wagon,Wagon,Grey,5,258353,Manual,Gasoline,6000,false,"Includes: Alloy wheels, Bluetooth, Cruise control, Air conditioning","$6000 OBO, or willing to entertain trades. For Sale is my 2002 Bugeye Subaru Impreza WRX Wagon. The car is in great condition considering the year with the exception of the paint job, which was painted by a previous owner and is now chipping. The car runs and drives extremely well and it pulls harder than Austin Powers pulled chicks. THE PROS: -Rebuilt Motor @237km -Front Mount Intercooler -3 inch turbo back exhaust with resonator -Cold Air Intake -AutoTechnica Digital boost gauge -Brand New Winter Tires on Steelies -Double Din JVC Bluetooth Touchscreen -Wired for Subs -Alpine Alarm System -LED Color changing Sex lights -Aftermarket Steering Wheel with Quick Release -Aftermarket Shift knob and boot -COBB Short Throw -Perrin Front Strut -Hella Horns -Stage 2 Tune THE CONS -Paint -Cracked Windshield -Front Transaxle making a clicking and grinding noise (Still completely driveable but will need to be replaced or rebuilt in future) I love this car and will hate to see it go but looking to upgrade to a truck for more practical reasons as I live out in the country. Car comes with another set of headlights, a set of aftermarket rims that will need rubber. Km will go up as it is my daily. Feel free to hit me up and ask any questions and will be willing to supply any other pictures upon request, have a bunch more but for some reason its only allowing me to post these 4. Thank you for your time.",https://www.kijiji.ca/v-cars-trucks/edmonton/2002-subaru-impreza-wrx/1430453403
1999,Used,Subaru,Legacy,N/A,Wagon,N/A,0,150000,N/A,N/A,4500,false,None,"I have a fairly clean legacy gtb . Car is in nice shape I have a motor to put in it with less kms and no rod knock currently has rod knock. 4500 cash with motor put in or open to trades if you put in the motor. Quads sxs or other fun cars. It has around 140000 KMS I believe will check tomorrow and update the add. Has a touch screen deck wiring for subs. Can come with the spare car that has the donor engine, both cars would need to be trailered. Like I said plan on putting motor in soon. Just thought I put a feeler add up for it.",https://www.kijiji.ca/v-cars-trucks/edmonton/1999-subaru-legacy-gtb/1432584540
2007,Used,Dodge,Caliber,SXT,Wagon,Blue,0,211763,Automatic,N/A,3998,true,None,Southside Certified KIT REF ID: 16924224,https://www.kijiji.ca/v-cars-trucks/edmonton/2007-dodge-caliber-sxt/1428110028
