0,N/A,N/A,N/A,N/A,N/A,N/A,0,0,N/A,N/A,0,false,None,N/A,N/A
2001,Used,Subaru,Legacy,N/A,Wagon,N/A,0,120000,Manual,N/A,1,false,None,"Looking to trade my GTB for something else. Ideally something manual and rwd. Nothing wrong with the car it just really isn’t my cup of tea. First Canadian owner. Rough idea of the car: 5 speed manual 120k km Straight pipe from downpipes (Loud but not deafening) Valve cover gaskets, spark plugs, brake pads and rotors, new exedy clutch, energy shifter bushings, Alpine type S speakers 2 12” subs, double din touchscreen head unit, JDM zerosports front and rear strut bar Couple bumps and scratches around body due to shipping damage Car will be getting tuned by Project Lambda to properly run on 91 octane fuel in a few days. Message me for more info and pics Only interested in rwds / jdms",https://www.kijiji.ca/v-cars-trucks/edmonton/01-subaru-legacy-gtb-e-tune-swap-trade/1430671698
2006,Used,Chrysler,PT Cruiser,N/A,Wagon,White,0,159000,Automatic,N/A,2300,false,Includes: Air conditioning,"Car runs and drives great few rust spots and dents, very clean interior. Everything works, recent oil change. REMOTE STARTER!!!, non smoker. Call 5875002463 to view asking 2300. OBO New all season tires comes with 3 winter tires on rims",https://www.kijiji.ca/v-cars-trucks/edmonton/2006-pt-cruiser/1433111016
2001,Used,Subaru,Legacy,Gt-b Blitzen,Wagon,Silver,5,95000,Manual,Gasoline,6000,false,None,"It has a 2.0L twin turbo engine. Runs and drives great. You get the speed of a wrx with the space of a wagon. Had to sell it but I've got to many cars and not enough time to enjoy them. The starter hangs on a little after it starts. I have a new one to replace it, just haven't had time yet",https://www.kijiji.ca/v-cars-trucks/edmonton/2001-subaru-legacy-blitzen-edition/1424426539
2007,Used,Nissan,Versa,1.8S,Wagon,Silver,0,214148,Manual,Gasoline,4495,true,None,"Karma Cars Alberta Ltd. Excellent fuel saving with this compact hatchback!! Come down Karma Cars on the corner of 75 St and 77 Ave or call 780-777-4444 for more information.?"Karma Cars Car Buying That Pays". AMVIC Licensed. Disclosure: $651 CarFax Claim, Alberta and Ontario Unit ? At Karma Cars we help you Buy A Car The Right Way Not only will Karma Cars get you driving, our team of financial experts with over 20 years of experience will make sure your payments are right for you, long-term. Regardless of your current financial situation, our passionate team of experts will explore every possible option to get you in a vehicle you want, at a payment you can afford, hassle free. Bad Credit, No Credit - No Hassle At Karma Cars, we alleviate the hassle of the car buying experience, regardless of whether you have less than perfect credit or not. We can have you driving with no credit check and no hassle. It is our mission to help you get approved for an auto loan quickly and easily. The Respect You Deserve Whatever circumstances you are facing, financially or otherwise, we will treat you with the respect you deserve. We are not your average car dealership. Our team is comprised of financial, sales and auto experts who all share a passion for helping people. KIT REF ID: 14439712",https://www.kijiji.ca/v-cars-trucks/edmonton/2007-nissan-versa-1-8s-0-financing-available-no-credit-che/1400618846
2005,Used,Subaru,Impreza,N/A,Wagon,Black,5,275000,Manual,Gasoline,2000,false,None,subaru impreza. 2005. manual transmission. 275000 km,https://www.kijiji.ca/v-cars-trucks/edmonton/subaru-2005/1425150391
2007,Used,Ford,Focus,N/A,Wagon,Black,5,233850,Automatic,Gasoline,2600,false,"Includes: Sunroof, Alloy wheels, Cruise control, Air conditioning","Selling my 2007 Ford focus ses wagon, car runs smooth and it is in excellent condition with no mechanical issues or accidents. Recently installed the new battery with $250, maintained very nicely, needs no work, ready to drive, no leaks, it comes with heated seats, leather seats, power sunroof, alloy wheels and has traction control that helps greatly on the snowy roads. Everything is in perfect condition we are selling as we are moving. PLEASE call or text 7806551701 Location: Edmonton, AB • 0 kilometres away Kilometres: 233850 km Transmission: Automatic Exterior Colour: Pitch Black (Black) Interior Colour: --- Fuel Economy: 10 L/100km City 7 L/100km Highw ay Engine: I4 Drivetrain: Front-Wheel Drive VIN: 1FAFP36N87W100533 Stock #: 1285 Major Options: Leather Seats, Alloy Wheels",https://www.kijiji.ca/v-cars-trucks/edmonton/2007-ford-focus-zxw-ses-wagon/1433238354
2007,Used,Chrysler,PT Cruiser,N/A,Wagon,Blue,5,140000,Automatic,Gasoline,3100,false,"Includes: Alloy wheels, Cruise control, Air conditioning","Hi, I'm selling my Pt cruiser 2007. It comes with 2 way remote starter, winter tire, Original rim with all season tire and engine block heater) Only driven 2 days a week for 5 kms. I bought this car last year Dec from second owner. Engine oil, starting motor and Thermostat changed recently (Can show the receipt). Also mechanic checked the engine and battery condition. It mint condition beautiful car. Asking 3500 text me if interested at 204-227-2847. thanks",https://www.kijiji.ca/v-cars-trucks/edmonton/reduced-2007-pt-cruiser-very-nice-car/1431373056
2002,Used,Subaru,Forester,S,Wagon,Black,5,300000,Manual,Gasoline,6000,false,"Includes: Sunroof, Alloy wheels, Bluetooth, Cruise control, Air conditioning","This is a LHD Forester sti version6 ej205 turbo motor swapped na fozz. Motor and trans has 60000kms on it Every bushing control arm subframe diff driveshaft etc was also taken off the jdm Forester (which had 75000kms on it) to replace the older higher km stuff on this car. Car also has the full jdm interior swapped into it from the Forester St/b model, including Momo wheel, arm rest rear seats and the gauge cluster. It has the sti hood and hatch which are not not cheap items. I have a new forester sti gril with the pink jdm f that comes with the car. Comes with both sets of wheels and tires seen in the photos. One are performance tires one set are winters. If you don't want the winters take 400 of the price listed and I'll keep them. This Forester has the moonroof and it is functioning perfectly. Factory Subaru "Forester" branded roof rack Parts that are brand new within the year are Rack and pinion assembly Lower ball joints Outer tie rods Rotors Brake pads Has downpipe back custom exhaust system with a blue tip from Alta exhaust it sounds nice but is not a loud ricer. Perfect for a daily in my opinion. Car is very hard to find in this setup and I won't be taking any offer lower than I have posted, because honestly for what this car has to offer this is a cheap price.",https://www.kijiji.ca/v-cars-trucks/edmonton/2002-forester-s-sti-swapped/1431329068
2004,Used,Audi,Quattro,N/A,Wagon,Brown,5,252000,Automatic,Gasoline,5000,false,"Includes: Sunroof, Alloy wheels, Parking assistant, Cruise control, Air conditioning","I am selling Audi allroad quattro C5, 2.7biturbo V6 engine. FULLY LOADED. I have this car since Apr.2016 since then never have any major problems. This car is very strong and reliable trusted car, Winter for this car is a joke. Comes with almost brand new Tires and two sets of keys,new wiper blades. New Battery. No smoking and pet free. Since I have the car I change: Alternator, Coolant Sensor, A/C Recharge, outer rear right tie rod end, right front and left front cv axle shaft, upper control arms, front tie rod. Front right Air suspension Arnott and Rear right air suspension Arnott, front left and right rotors and brake pads, I recently change the rear differential fluid. I have all receipts. This car is a luxury off road car. Only windshield have cracks. Asking 5000$ Please take your license plate for test drive. Aleks. 780 984-6583",https://www.kijiji.ca/v-cars-trucks/st-albert/audi-allroad-2004/1432584163
2007,Used,Dodge,Caliber,SXT,Wagon,Black,5,243000,Automatic,Gasoline,1000,false,"Includes: Cruise control, Air conditioning","Put alot of new parts in. -new front end struts -new block heater and plug in -new oil/transmission fluid and filters -new coolant hoses and fluid change -new air filter and cabin filter -cleaned throttle body and MAF sensor -flushed heater core now has better heat circulation -spare tire in trunk compartment -comes with scissor jack Cons: recent engine knock dealership suspects rod bearing but unsure. Slow oil pan leak, and rear struts could use a replacement. Car will still run but eventually need to be fixed or engine could quit. Selling as is. Was my daily driver solid car. Just not rich enough to pay for engine knock. Comes with some receipts and Carfax. Never in an accident. Asking $1000. Won't go lower",https://www.kijiji.ca/v-cars-trucks/edmonton/2007-dodge-caliber-sxt/1431582754
2005,Used,Volkswagen,Jetta,N/A,Wagon,Red,5,221486,Automatic,Diesel,3500,false,"Includes: Sunroof, Cruise control, Air conditioning",First owner no smoker .,https://www.kijiji.ca/v-cars-trucks/edmonton/jetta-volkswagen-tdi/1429788185
2011,Used,Kia,Rondo,EX For Sale Edmonton,Wagon,Red,0,177036,Automatic,Gasoline,5999,true,None,"This vehicles full disclosure for example accidents, vehicle usage, are available with the Carfax Report provided. ***AMVIC Licensed Business Engine: 6 cylinder 2.7L Optional Equipment Driver Air Bag CD Player ABS Traction Control Fog Lamps Cruise Control Rear Defrost Engine Immobilizer Tow Hooks Power Steering Passenger Air Bag MP3 Player Front Side Air Bag Bucket Seats Front Reading Lamps Adjustable Steering Wheel Power Outlet Remote Trunk Release Auxiliary Audio Input AM/FM Stereo Floor Mats Keyless Entry Driver Adjustable Lumbar Child Safety Locks Heated Mirrors Aluminum Wheels Front Wheel Drive Cloth Seats Tires - Rear All-Season Power Windows Driver Vanity Mirror Passenger Illuminated Visor Mirror Bluetooth Connection Rear Head Air Bag A/C Pass-Through Rear Seat Driver Illuminated Vanity Mirror Front Head Air Bag Intermittent Wipers Variable Speed Intermittent Wipers Steering Wheel Audio Controls Passenger Vanity Mirror Stability Control Leather Steering Wheel Passenger Air Bag Sensor 4-Wheel Disc Brakes Power Mirror(s) Rollover Protection Bars Power Door Locks Heated Front Seat(s) Rear Bench Seat Tires - Front All-Season KIT REF ID: 17060314",https://www.kijiji.ca/v-cars-trucks/edmonton/2011-kia-rondo-ex-for-sale-edmonton/1429885557
2007,Used,Ford,Focus,N/A,Wagon,Black,5,233850,Automatic,Gasoline,2700,false,"Includes: Sunroof, Alloy wheels, Cruise control, Air conditioning","Selling my 2007 Ford focusses wagon, car runs smooth and it is in excellent condition with no mechanical issues or accidents. Recently installed the new battery with $250, maintained very nicely, needs no work, ready to drive, no leaks, it comes with heated seats, leather seats, power sunroof, alloy wheels and has traction control that helps greatly on the snowy roads. Everything is in perfect condition we are selling as we are moving. PLEASE call or text 7806551918. we bought dear only come and look who will take this is a very good car.dont think about kilometres. Location: Edmonton, AB · 0 kilometres away Kilometres: 233,850 km Transmission: Automatic Exterior Colour: Pitch Black (Black) Interior Colour: --- Fuel Economy: 10 L/100km City 7 L/100km Highw ay Engine: I4 Drivetrain: Front-Wheel Drive VIN: 1FAFP36N87W100533 Stock #: 1285 Major Options: Leather Seats, Alloy Wheels",https://www.kijiji.ca/v-cars-trucks/edmonton/ford-focuse/1432797217
2006,Used,Subaru,Legacy,2.5i,Wagon,Silver,5,188362,Automatic,Gasoline,5400,false,"Includes: Sunroof, Alloy wheels, Cruise control, Air conditioning","Recently bought a new car and need to sell my 06 legacy. The second owner of the car, have owned it for about 11 years since about 45k kilometres; quite sad to see it go. Car is STOCK, no modifications done to it. Is an incredibly fun car to drive, been very reliable, and handles very well (especially in the winter). Just over 188k on the car and not getting driven much so km should remain the same. Well maintained and full synthetic oil changes every 5-6k km. Would make a great first car/daily driver. Features: -Symmetrical AWD -Heated seats -Moonroof -A/C -Power Drivers Seat -Different driving modes: Sport, Manual shifting -Heated wipers -Features the classic subaru rust spot on passenger rear fender -Lots of storage room -Comes with winter floor mats -Cruise Control -Power Windows Will also throw in a roof rack!",https://www.kijiji.ca/v-cars-trucks/strathcona-county/2006-subaru-legacy-2-5i-special-edition-awd/1432110133
2004,Used,Subaru,Impreza,N/A,Wagon,Blue,5,189300,Automatic,Gasoline,4500,false,"Includes: Cruise control, Air conditioning","Up for sale is my 2004 Subaru Impress 2.5 ST. Serviced regularly and runs smoothly. Clean, non smoker with no pet. Comes with all power options including remote starter and keyless entry. Also original user''s manual is available. Minor scratches and rust spots. It's the cheapest but very reliable small AWD car you can enjoy drivin it winter and summer. Review it. Selling it because my family size increased and needs to get a bigger car.",https://www.kijiji.ca/v-cars-trucks/edmonton/2004-subaru-impreza-sport-wagon-for-4500/1429820609
2004,Used,Toyota,Matrix,XR,Wagon,Red,4,222000,Manual,Gasoline,4300,false,None,"For sale Toyota Matrix XR (5 speed manual) Vehicle has 221000 kms 12000 kms on new tires and rims Powerful TRD Brakes (4 piston calipers, ... ), TRD short shifter, TRD upper and lower stabilizer bars Vehicle received new front and back suspension (BC Racing Dynamics) 10000 kms ago BC Racing suspension allows to adjust height, stiffness as well as camber Tinted windows Windshield has a crack Synthetic oil was only used (leaks of any sorts and oil burn is absent) Power windows Block heater Accident free Rust free Dent/scratch free Clean car Please note: price is negotiable, no trades, if the ad is up - the car is still available (email or text) Economical, fast and nimble $4300 OBO",https://www.kijiji.ca/v-cars-trucks/edmonton/2004-toyota-matrix/1385142871
2008,Used,Chrysler,Pacifica,Touring,Wagon,Silver,0,145774,Automatic,Gasoline,5495,true,None,"ALL vehicles INSPECTED and DETAILED. ALL vehicles come with a Mechanical Fitness Assessment. FINANCING available (on select vehicles). DEALERS and WHOLESALERS welcome! COMES WITH 2 YEARS POWER TRAIN WARRANTY BRAND NEW TIRES BRAND NEW BRAKES COMPLETELY SERVICED WITH SUPPORT DOCUMENTS Please call us, or visit 104 Street + 79 Avenue. THANK YOU for your interest. We appreciate your business! --- PHONE: 780-433-2517 EMAIL: sales@eurosportauto.ca WEB: eurosportauto.ca --- Euro Sport Auto Sales Ltd. is an AMVIC (Alberta Motor Vehicle Industry Council) Licensed Dealer...... Engine: V6 Cylinder Engine 4.0L/241 L/100Km City: 14.4 L/100Km Hwy: 8.8 Mechanical Equipment 160-amp alternator 2.24 top gear ratio 4.0L SOHC V6 engine 600-amp maintenance-free battery w/pwr accessory delay Brake/park interlock Bright exhaust tip Compact spare tire Engine block heater Front wheel drive Load levelling & height control Interior Equipment 2nd row folding rear seat 3rd row bench seat 6-passenger seating Analog clock Auto-dimming rearview mirror Cargo fold-flat floor storage Cargo tie-down loops Dual illuminated visor vanity mirrors Front/rear 12V pwr outlets Front/rear floor consoles Exterior Equipment Accent/body colour fascias Body colour door handles Bodyside moulding Deluxe insulation group w/hood insulation Dual reflector automatic halogen headlamps w/time delay Fog lamps Lower bodyside cladding Rear window wiper/washer Side roof rails Sunscreen/solar control glass Safety Equipment Brake/park interlock Child seat anchor system (LATCH) Driver/front passenger Next Generation air bags Driver-side inflatable knee-bolster air bag Electric dual note horn Front/2nd/3rd row side curtain air bags Rear child safety door locks Factory Options 4.0L SOHC V6 ENGINE KIT REF ID: 13696367",https://www.kijiji.ca/v-cars-trucks/edmonton/2008-chrysler-pacifica-touring/1391560738
2003,Used,Mazda,Protege,N/A,Wagon,Blue,5,190000,Manual,Gasoline,1500,false,"Includes: Sunroof, Cruise control, Air conditioning","2003 Mazda Protégé 5. 193,000 km. No accidents and oil changes done every 5000 km. 5 speed manual Sunroof Air conditioning Power locks Fresh set of winter tires used only for 1 season. Summer tires included as well. Clutch is a little worn, otherwise great car for someone to daily drive and learn manual on. Price: $1500 OBO Please text 780-860-9043",https://www.kijiji.ca/v-cars-trucks/edmonton/2003-mazda-protege-5/1432580779
2004,Used,Volkswagen,Jetta,GLS,Wagon,Silver,5,143800,Automatic,Gasoline,4900,false,None,"1.8L-4 CYL, 143,800 KM'S READY TO DRIVE Mechanically inspected yesterday, Highway KM's, Lady Driven, synthetic oil change done recently, new front and back breaks,cheap on fuel, low KM'S, Automatic, Leather Interior, Power windows and locks, A/C, Sunroof, Heated seats, Traction control , AM/FM, CD STEREO, Original 4 rims in back, drives GREAT. NO DEALERSHIPS OR LOW BALLERS, REASONABLE OFFERS ACCEPTED, TEXT ONLY",https://www.kijiji.ca/v-cars-trucks/edmonton/2004-volkswagen-gls-turbo-ready-to-drive-needs-nothing/1431939362
2013,Used,Ford,Fiesta,SE,Wagon,Black,0,48795,Automatic,Gasoline,46,true,None,"Karma Cars Alberta Ltd. If you're looking for a fuel-efficient small car, but you don't want to sacrifice the interior quality or modern features usually found only on larger, more expensive models, the 2013 Ford Fiesta sub-compact is an easy choice. WE HELP ANY CREDIT!! BAD, REPOS, COLLECTIONS, BANKRUPTCY'S!! With multiple banks and in house financing we will get you approved and driving down the road. APPLY NOW by clicking on the link below http://karmacars.com/apply/ Come down Karma Cars on the corner of 75 St and 77 Ave or call 780-777-4444 for more information. "Karma Cars Car Buying That Pays". AMVIC Licensed. Disclosure: See Dealer Price 10,995 interest 12.49% 5.5 year term $2000 Down Payment $46 weekly payment o.a.c. At Karma Cars we help you Buy A Car The Right Way Not only will Karma Cars get you driving, our team of financial experts with over 20 years of experience will make sure your payments are right for you, long-term. Regardless of your current financial situation, our passionate team of experts will explore every possible option to get you in a vehicle you want, at a payment you can afford, hassle free. Bad Credit, No Credit - No Hassle At Karma Cars, we alleviate the hassle of the car buying experience, regardless of whether you have less than perfect credit or not. We can have you driving with no credit check and no hassle. It is our mission to help you get approved for an auto loan quickly and easily. The Respect You Deserve Whatever circumstances you are facing, financially or otherwise, we will treat you with the respect you deserve. We are not your average car dealership. Our team is comprised of financial, sales and auto experts who all share a passion for helping people. Similar to Volkswagen Jetta, Chevrolet Cruze, Hyundai Elantra, Ford Focus, Nissan Sentra, Toyota Corolla, LE, CVT, S, L, 2010, 2011, 2012, 2013, 2014, 2015, 2015, 2017, 2018 + Engine: 4 Cylinder Engine 1.6L/97 L/100Km City: 6.9 L/100Km Hwy: 5.1 Mechanical Equipment 1.6L Ti-VCT I4 engine Easy Fuel capless fuel filler Electronic pwr assisted steering (EPAS) Front wheel drive Hill start assist Pwr front disc/rear drum brakes Interior Equipment (6) cupholders -inc: (5) 1st row, (1) 2nd row Anti-theft engine immobilizer Centre dome lamp w/map lights Cloth door inserts Driver footrest Front consolette Front door storage bins Front sunvisors w/vanity mirror Front/rear carpeted floor mats Instrument cluster -inc: tachometer, message centre, trip computer Manual air conditioning Metallic painted interior trim -inc: centre finish panel, door handle bezels, IP canisters, steering wheel spokes, air cond register bezels Metallic painted shift knob Passenger seatback map pocket Exterior Equipment 60/40 split rear seats w/foldable head restraints Black beltline & decklid mouldings Body-colour bumpers Body-colour door handles Body-colour upper grille Intermittent windshield wipers P185/60HR15 all-season BSW tires Quad-beam halogen headlamps Rear liftgate spoiler Rear windshield wiper Safety Equipment "Smart" front passenger occupant detection system (PODS) 4-wheel anti-lock brake system (ABS) AdvanceTrac w/electronic stability control (ESC) Child safety rear door locks Driver & front passenger dual stage frontal airbags Driver knee airbag Front seat side airbags Front/rear side curtain airbags Height adjustable seatbelts w/pretensioners Tire pressure monitoring system Entertainment Equipment (4) speakers Factory Options 1.6L TI-VCT I4 ENGINE KIT REF ID: 12812060",https://www.kijiji.ca/v-cars-trucks/edmonton/2013-ford-fiesta-se-bad-credit-only-46/1399390924
2007,Used,Subaru,Outback,N/A,Wagon,Blue,0,185000,Manual,N/A,4800,false,None,"Awesome little Subaru. Runs perfect. leaks a bit of oil from valve gaskets and cam seal. Other than that. Clutch, tranny and all electronics are in great shape. Body and interior very nice.",https://www.kijiji.ca/v-cars-trucks/edmonton/2007-subaru-outback/1409585208
2001,Used,Volkswagen,Golf,N/A,Wagon,White,5,345379,Manual,Gasoline,2250,false,"Includes: Sunroof, Alloy wheels, Air conditioning",- New clutch - Good battery - Standard transmission - Used all season tires,https://www.kijiji.ca/v-cars-trucks/edmonton/mk4-voltswaggon-golf-fwd-manual/1424275890
2009,Used,Nissan,Cube,1.8 SL,Wagon,Grey,0,171352,Other,Gasoline,5995,true,None,"ALL vehicles INSPECTED and DETAILED. ALL vehicles come with a Mechanical Fitness Assessment. FINANCING available (on select vehicles). FREE 3 MONTH WARRANTY. TRADES WELCOME. DEALERS and WHOLESALERS welcome! --- Please call us, or visit 104 Street + 78 Avenue. THANK YOU for your interest. We appreciate your business! --- PHONE: 780-433-2517 EMAIL: sales@eurosportauto.ca WEB: eurosportauto.ca --- Euro Sport Auto Sales Ltd. is an AMVIC (Alberta Motor Vehicle Industry Council) Licensed Dealer...... Engine: 4 Cylinder Engine 1.8L/110 L/100Km City: 7.3 L/100Km Hwy: 6.5 Mechanical Equipment (2) solid & (1) liquid engine mounts 1.8L DOHC SMPI 16-valve I4 engine Battery saver Continuously variable valve timing control (CVVTCS) for intake valves only CVT oil warmer Electric pwr speed sensitive steering Electronic brake force distribution Engine block heater w/cord Front independent strut suspension w/stabilizer bar Front vented disc & rear drum brakes Interior Equipment "Water-drop" pattern headliner (2) front moveable "Ripple" hooks (4) front cupholders (4) luggage-side & (2) floor cargo area hooks (5) bottle holders -inc: (4) in door panels & (1) in centre console 3-piece floor mat set Automatic climate control -inc: in-cabin microfilter Cable fuel lid release Chrome-plated door handles Coin box Exterior Equipment 16" x 6" dual-spoke alloy wheels Automatic on/off multi-reflector halogen headlights Body-colour door handles Body-colour front & rear bumpers Body-colour heated pwr mirrors Dark grey grille Fog lights Intermittent rear wiper w/washer P195/55R16 all-season tires Rear privacy glass Safety Equipment 3-point ELR driver & ELR/ALR passenger seat belt system -inc: front height adjustable seat belts w/pretensioners & load limiters Child safety rear door locks Curtain side-impact airbags Driver & front passenger frontal airbags -inc: passenger occupation sensor Electronic brake force distribution Energy absorbing bumpers Front & rear crumple zones Front seat side-impact airbags LATCH system -inc: tether & lower anchors for rear outboard positions Steel pipe-style side-door impact protection Entertainment Equipment 150-watt AM/FM stereo w/CD/MP3/WMA player -inc: (6) speakers, auxiliary input, radio data system (RDS), speed sensitive volume control, iPod connectivity Short rod-type roof-mounted antenna KIT REF ID: 17371289",https://www.kijiji.ca/v-cars-trucks/edmonton/2009-nissan-cube-1-8-sl/1433428607
2003,Used,Mazda,Other,ES,Wagon,Red,5,188000,Other,Gasoline,3000,false,"Includes: Alloy wheels, Cruise control","This 2003 Mazda Protege hatchback has been a great car for me during University. However as I am now moving to Toronto for work I have to say goodbye. This car is very fun to drive, and would make a great first car. $3400 or a reasonable offer. Features: - Power windows/locks - Cruise control - Rear tires are all season, front tires are all weather, both medium wear Work Done: -Oil change was recently done at 187 500 km. -Water pump, timing belt, and brakes were done at 185 000 km. -Spark plugs and ignition coils replaced around 160 000 km. Noted issues: As with most Mazda models of this age there is some body rust. I have tried to keep it under control by painting with rust inhibitor on a yearly basis and colour matched paint. Some areas have been remodeled using bondo fibreglass. (See photos). The emergency brake light comes on periodically due to touchy right rear ABS sensor. This has been happening since I bought the car in 2014 and I haven't had any issues. ODB2 Code: C1168 The engine light comes on periodically due to catalytic converter operating at less than 100%. This is a common issue with Protege but is not significant. This has been happening since I bought the car in 2014 and I haven't had any issues. ODB2 Code: P0421 If you are interested in seeing the car or test driving please contact me!",https://www.kijiji.ca/v-cars-trucks/edmonton/mazda-protege-hatchback/1431323706
