0,N/A,N/A,N/A,N/A,N/A,N/A,0,0,N/A,N/A,0,false,None,N/A,N/A
1999,Used,Subaru,Outback,N/A,Wagon,White,5,332016,Manual,Gasoline,3400,false,None,1999 Subaru Outback Wagon Selling as I'm moving out of province. Just passed Alberta provincial inspection November 2018 (record of inspection provided) Fantastic gas mileage Body in great shape Manual transmission All wheel drive Heated seats Roof rack *Needs an O2 censor and a front strut New: Rims & Tires (18") Battery Brakes Alternator Windshield Asking $3400 * negotiable,https://www.kijiji.ca/v-cars-trucks/edmonton/1999-subaru-outback-wagon/1432087144
2002,Used,Ford,Focus,N/A,Wagon,N/A,0,181678,Manual,N/A,1800,false,"Includes: Sunroof, Alloy wheels, Bluetooth, Cruise control, Air conditioning",Great car Runs shits and drives very well Fully loaded with leather Bluetooth sunroof just changed the struts tires are good great for a dialy driver highway or city very good on gas 4 cylinder 2.0L $1800.00,https://www.kijiji.ca/v-cars-trucks/edmonton/2002-ford-focus-interior-looks-like-new-runs-amazing/1431829859
1999,Used,Chevrolet,Suburban,N/A,Wagon,Blue,6,202000,Automatic,Gasoline,3000,false,"Includes: Alloy wheels, Bluetooth, Cruise control, Trailer hitch, Air conditioning","Picked this up in Arizona for driving back and forth to Canada, but only got here and no longer require it. Spent its entire life in the desert and it shows, the undercarriage looks amazing, there is little to no rust! If you know these vehicles you know they seldom stop until at least 500 000km! Body is supurb, there has been tonnes of work to it as the previous owner was very meticulous, brakes, suspension, battery, engine components, fuel tank and pump, AC recharge. The interior has a rip on the drivers side leather seat and carpets are dirty, hence the price, but otherwise, a vehicle that is good to go! The truck was repainted and color changed from silver, stereo head unit was upgraded, can be viewed just off Whyte Ave. Cheers. 126000 miles....202000 km's The bad, the key tumbler to the driver side is wrecked and needs replacing, but Keyless entry works, the dash is cracked from the desert sun, a dash cover rug is over it which hides it.",https://www.kijiji.ca/v-cars-trucks/edmonton/1999-chevrolet-suburban-1500-4wd-awd-2wd/1424922001
2008,Used,Chevrolet,HHR,Panel,Wagon,Silver,2,175000,Automatic,Gasoline,5500,false,"Includes: Cruise control, Air conditioning",This little cruiser is in very good shape. Did a complete tune up in September 2018. New windshield and tires this month. Very good on fuel as it averages 7.8 liters per 100 kilometers and runs like a top. She has a bit of hail damage. These wagons are hard to find and are fun to drive. Call me at 780-986-9206 and leave a message with the butler if we aren't available. This HHR is a good value at $5500.00,https://www.kijiji.ca/v-cars-trucks/edmonton/ready-to-rock-2008-chevy-hhr-5500-00/1433172420
2004,Used,Volkswagen,Jetta,TDI,Wagon,Red,4,295000,Automatic,Diesel,3900,false,"Includes: Sunroof, Alloy wheels, Cruise control, Air conditioning","Up for sale my work horse, 2004 VW Jetta TDI wagon tuned by Malone. Currently has a so called 1.5 stage tune with all extra accessories like high idle, different glow plug voltage, adaptive egr, etc. As it sits now car has almost 300,000km, minor rust and like all old Volkswagens and cars in general it has it's own faults. Front bearings need to be changed as well it probably needs a new set of shocks. This gem took me everywhere I went with ease and was extremely reliable in all weather conditions. Vehicle gets on average 1000km per tank, sometimes even up to 1300km if driven strictly on highway. Oil changed religiously at 5000km, and fuel filter every other oil change. Just been cleaned and ready to go. Everything works and it even has sunroof. We used this vehicle mainly to get to work and back so it definitely seen lots of highway driving which it sure loves. Has winter studded tires purchased last year during winter, newer all season tires used as summers, as well as leather front cover (which apparently is very hard to find on this model), coolant circulator / heater, oil pan heater. Thanks for viewing, Available during most weekends.",https://www.kijiji.ca/v-cars-trucks/edmonton/2004-vw-jetta-tdi-malone-tuning/1431189292
2008,Used,Subaru,Outback,2.5i,Wagon,Silver,5,229263,Automatic,Gasoline,5400,false,Includes: Cruise control,"Selling a 2008 Subaru Outback. Runs very well and drives well, no leaks of any kind currently. Healthy 2.5L n/a engine has minimal piston slap, no leakage and no issues. This cars not perfect, but definitely a good daily driver. Has dings and scratches, rock chips, and overall average condition for a vehicle of its age. Comes on a good set of Federal Himalaya winter tires on steelies, and comes with a set of worn out all seasons on OEM five spokes. Features steering wheel cruise control, power windows, power locks, power mirrors, 60/40 folding rear seat, and has an original head unit capable of Satellite Radio and Auxillary input. Text or Kijiji message preferred.",https://www.kijiji.ca/v-cars-trucks/edmonton/2008-subaru-outback-2-5i/1426476158
2009,Used,Kia,Rondo,EX,Wagon,Red,0,142475,Other,Gasoline,5997,true,None,"Aggressively Priced to SAVE YOU TIME! With Carproof Report, Mechanical Fitness Assessment, Go Card Rewards, $500 Referrals, FREE Service Loaners, 24/7 Support......At KENTWOOD FORD, YOU GET MORE! Call one of our HAPPY TO HELP Sales Associates Today for more information on this Vehicle TODAY! 780-377-1375 Proudly serving the Edmonton Area for 50 Years! Kentwood Ford is an AMVIC Licensed Dealer Engine: 2.7L V6 KIT REF ID: 17128371",https://www.kijiji.ca/v-cars-trucks/edmonton/2009-kia-rondo-ex/1430864501
1995,Used,Ford,Escort,LX,Wagon,White,5,225000,Automatic,Gasoline,500,false,None,"In running condition, minor rust. $500.00 OBO",https://www.kijiji.ca/v-cars-trucks/edmonton/1995-ford-escort-lx-wagon/1431550910
2007,Used,Dodge,Magnum,N/A,Wagon,White,5,360000,Automatic,Gasoline,2500,false,"Includes: Sunroof, Alloy wheels, Cruise control, Air conditioning","2007 Dodge Magnum 3.5L rear wheel drive.Power locks, power seats, power sunroof. New transmission last year Alpine CD stereo Alpine 6x9 speakers front and back Brake pads and rotors last year Air intake New aftermarket grill New battery Runs great just don’t need two vehicles",https://www.kijiji.ca/v-cars-trucks/edmonton/dodge-magnum/1426447335
1988,Used,Toyota,Land Cruiser,N/A,Wagon,Blue,0,351000,Automatic,Gasoline,3000,false,None,"Listing my cruiser. Real Rusty special Toyota land cruiser 1988 fj62 Straight 6 4.0L Recent work. Upgraded master brake to v6 hilux big bore style with matching front calipers New pads, rear drums and kit New tie rod ends and stabilizer Afe filter Front axle rebuilt heavy duty seals New koyo bearings Exhaust from "cat back" New rad Distributor wires Recent all glass replaced Headlights Toyota alternator Battery Someone did steal this for 1 day and in doing so needs Ignition and door lock (can be started) Alignment Always starts and drives. She runs smooth Electric windows and mirrors $3000 obo Text for more pics one7054411066",https://www.kijiji.ca/v-cars-trucks/edmonton/land-cruiser/1433338514
2005,Used,Dodge,Magnum,N/A,Wagon,Grey,5,335900,Automatic,Gasoline,1500,false,None,Runs and drives great it doesnt burn or leak oil tranny is like new it has after market eghxaust sounds really good needs two front tires windshield.fuel gauge sometimes work sometimes not interior needs good cleaning i used it for work if interested text or call me 5875665617 will consider trades,https://www.kijiji.ca/v-cars-trucks/edmonton/2005-dodge-magnum/1432816498
2007,Used,Toyota,Matrix,XR,Wagon,Blue,5,208000,Automatic,Gasoline,4999,true,"Includes: Alloy wheels, Bluetooth, Parking assistant, Cruise control, Air conditioning","2007 Toyota Matrix 2007-Reliable hatchback-with Extra 4 sets alloyed rim Tires, Alberta active , Automatic drive, with a very car-fax and Mechanical assessment .Our finance guys , would have you approved ASAP whether your credit is great or not. Please call or text us at 7802007909. We can as well deliver to your location . VEHICLE OPTIONS: Heated seats Airbag: side Alarm Anti-lock brakesr Traction control",https://www.kijiji.ca/v-cars-trucks/edmonton/toyota-matrix-2007-hatchback-spring-clearance-sales-price-reduce/1418510946
2006,Used,Ford,Other,SEL,Wagon,Red,0,0,Other,Gasoline,5999,true,None,"M3J's Motors Inc This is an amazing and loaded vehicale comes with power windows locks sunroof.7 passenger . Excellent Condition. Drives very amazing and is fully inspected. Clean carproof and is good to go. Smooth ride.. Conditioning Cruise control Power mirrors Power steering Power windows Rear window defroster CD changer Bucket seats Memory seats Airbag: driver Alarm Anti-lock brakes Traction control AMVIC LICENSED DEALER Our entire inventory is priced competitively in the market at all times. In order to guarantee you the best prices on the market. As you do your comparison shopping, you will see how M3J's Motors offers some of the best value in the market. We will provide car proof with vehicle history report. Price does Not include GST. Engine: V6 Cylinder Engine 3.0L/182 L/100Km City: 11.7 L/100Km Hwy: 8.1 Mechanical Equipment 17" 5-spoke bright aluminum wheels 3.0L 24-valve V6 Duratec engine 5.19 final drive ratio 72 litre gallon fuel tank Battery saver feature Engine block heater Front vented/rear solid disc brakes Front wheel drive Macpherson strut front/independent multilink rear suspension Mini spare tire Interior Equipment (12) total cup/bottle holders (2) coat hooks (3) auxiliary pwr points (3) retractable roof grab handles 2nd & 3rd row reading lamps Accessory delay Cargo area grocery bag hooks Cargo area light Carpeted 1st & 2nd row floor mats Colour-keyed leather-wrapped steering wheel w/audio & climate controls Exterior Equipment Black mould-in-colour grille w/chrome grille surround Body-colour folding heated pwr mirrors w/puddle lamps Body-colour painted door handles Fixed interval intermittent windshield wipers Fog lamps Halogen headlamps w/auto on/off Perimeter lighting Privacy glass 3rd row quarter windows & liftgate Roof rack Solar tinted glass Safety Equipment Child safety rear door locks Driver & front passenger dual stage air bags Driver/front passenger Belt Minder system Dual note horn LATCH (Lower Anchors and Tethers for CHildren)-inc: (2) in 2nd row, (1) in 3rd row Occupant classification system Personal safety system-inc: seat belt pretensioners, load-limiting retractors, driver seat position sensing & crash severity sensing Side impact protection system Factory Options 3.0L 24-VALVE V6 DURATEC ENGINE KIT REF ID: 16930218",https://www.kijiji.ca/v-cars-trucks/edmonton/2006-ford-freestyle-sel/1428237228
2005,Used,Kia,Rio,"RX-V WAGON; SUPER LOW KMS, 5 PASS, A/C AND MORE",Wagon,Grey,0,69825,Automatic,Gasoline,5888,true,None,"2005 Kia Rio Wagon Our 2005 Kia Rio Wagon comes with very low mks for its year, and comes with power windows, power locks, power mirrors, AM/FM/CD player, air conditioning, a comfortable 5 passenger cloth seating, large trunk space, alloy wheels and more Interested? Need more information? Contact our Internet sales team at 780-465-3535, gokiasouthsalesleads@gokia.ca or come on in! Located at 3030 Gateway Blvd, Edmonton, AB. Just north of 23rd Ave between Calgary Trail and Gateway Blvd ... you can't miss us! Go Kia South is an AMVIC-licensed business Engine: 1.6L Inline4 KIT REF ID: 16632502",https://www.kijiji.ca/v-cars-trucks/edmonton/2005-kia-rio-rx-v-wagon-super-low-kms-5-pass-a-c-and-more/1425071392
2004,Used,Volvo,XC70,N/A,Wagon,Black,5,310500,Automatic,Gasoline,3399,false,"Includes: Sunroof, Alloy wheels, Cruise control, Air conditioning","2004 Volvo XC70 AWD 2.5 In nice condition, full loaded vehicle All power Alberta registered, Active Very clean inside as well as outside No rust, no dent, no scratches, no smell of smoke, no fur from pets New brake pads and rotors all around New All Season tires Heated seats ( power Sunroof Fresh synthetic oil (just changed today) Lather interior Climate control Windshield crack Stop lamps need a check up ( need to be fixed) If you are interested CONTACT ME AT +17802244727, the car is already waiting for you!",https://www.kijiji.ca/v-cars-trucks/edmonton/2004-volvo-xc70-awd-2-5/1433296309
2007,Used,Subaru,Legacy,N/A,Wagon,Green,0,223984,Automatic,N/A,6000,true,None,"2007 Subaru Legacy Outback, 2.5-F4 (175hp), 5 Passenger Wagon, Auto, All Wheel Drive, fully loaded, power windows and locks, Alarm, cold A/C, brand new windshield, newer tires, Full Cloth int., Premium Am/Fm/CD/Player, Free Carproof copy on hand, Alberta Regi, Excellent Running cond., Vehicle Comes With Inspection Report by Certified Mechanic. This Car was over $32,000 new ... $6,000 ... *** BRAND NEW WATER PUMP/ TIMING BELT/HEAD GASKET *** 780.455.5919 ...AMVIC Licensed Dealer... ...Got Trades? ... ... NOW FINANCING AVAILABLE ... We are located in EDMONTON our address is: *** 14421 Mark Messier Trail *** T6V-1H4 **** Call for more info 780.455-5919 *** OVER 125+ CARS IN STOCK **** IMPORTS/LUXURY *** All VEHICLES COME WITH AN INSPECTION REPORT BY INDEPENDENT CERTIFIED MECHANIC *** WE OPEN DAILY 9:30am-8:00pm *** SATURDAY 10:00am-6:00pm *** SUNDAY 12:00pm-4:00pm *** ALL TRADES ARE WELCOME*** WE OPEN AFTER HOURS BY APPOINTMENTS TO VIEW OUR OTHER ADS PLEASE CLICK ON ***VIEW POSTER'S OTHER ADS*** ON THE TOP RIGHT HAND CORNER ~Family Owned Business '2003 ~ We Specialize in " JUST GOOD CARS " KIT REF ID: 16664804",https://www.kijiji.ca/v-cars-trucks/edmonton/2007-subaru-legacy-outback-auto-awd-new-timing-belt/1425267270
2001,Used,Subaru,Legacy,Outback w/GB Equip,Wagon,Blue,0,246233,Manual,Gasoline,3900,true,None,"AMVIC INSPECTED AWD, Alloy Wheels, P Seat, Manual Engine: 4 Cylinder Engine 2.5L/150 Mechanical Equipment 16" alloy wheels 16.9 gallon fuel tank (2000) 2.5L SOHC SMPI 16-valve 4-cyl horizontally opposed "Boxer" engine 5-speed manual transmission w/OD All-wheel drive Front/rear stabilizer bar HD raised independent front/rear suspension P225/60HR16 all-season SBR RWL mud & snow tires Pwr vented front/solid rear disc brakes Speed-sensitive variable assist pwr rack & pinion steering Interior Equipment 2 front/2 rear cupholders 60/40 split fold down rear bench seat 6-way pwr driver seat Air conditioning Cargo area hooks Cargo area security cover Cargo area/trunk multibox storage tray Cruise control Driver seat adjustable lumbar support Driver seat height adjustment (2000) Exterior Equipment 2-tone paint (2000) Aerodynamic body-color body-side ground effects molding Automatic-off multi-reflector halogen headlights Body-color lower body-side cladding Dual body-color fold away heated pwr mirrors Front/rear body-color bumpers Front/rear splash guards Multi-reflector halogen fog lights w/stone shields Protective rear bumper step pad Raised roof line (2000) Safety Equipment 3-point seatbelts on all seating positions Child safety rear door locks Driver & front passenger airbags (SRS) w/passenger dual stage deployment Energy-absorbing collapsible steering column Front/rear 5-mph impact-absorbing bumpers Height adjustable shoulder belts on front seating positions Side-impact door beams Uniform child safety seat anchorage system KIT REF ID: 17212764",https://www.kijiji.ca/v-cars-trucks/edmonton/2001-subaru-legacy-wagon-outback-w-gb-equip/1431594433
2006,Used,Mercedes-Benz,R-Class,3.5L,Wagon,Black,6,192000,Automatic,Gasoline,5000,false,"Includes: Sunroof, Cruise control, Air conditioning","Selling a 2006 Mercedes Benz R350, Black Leather Interior with heated Seats, Air Conditioning, Power Doors, Power Windows, Panoramic Sliding Sunroof but currently not working, Vehicle Runs well and is currently active. Front and Rear bumpers damaged as seen in pictures. Message me for Viewing. Serious Inquires only please, No dealerships.",https://www.kijiji.ca/v-cars-trucks/edmonton/2006-mercedes-benz-r-class-3-5l-wagon/1433132093
2007,Used,Dodge,Caliber,SXT,Wagon,Blue,0,211763,Automatic,N/A,3998,true,None,"Interested? Need more information? Contact our Internet sales team at 780-701-1338, or come on in ... ! South Side Mitsubishi is located at 9605 34 Ave NW, Edmonton, AB, right on the corner of 34 Ave and 97 Street ... you can't miss us! We are proud to serve Edmonton and the rest of Alberta. Southside Mitsubishi is an AMVIC Licensed Dealer Engine: Gas I4 2.0L/122 KIT REF ID: 16924225",https://www.kijiji.ca/v-cars-trucks/edmonton/2007-dodge-caliber-sxt/1428109690
2007,Used,Dodge,Caliber,SXT,Wagon,White,0,209842,Manual,Gasoline,5569,true,None,"Sherwood Honda Keyless entry Roof rails Universal Garage door Opener Fog lights AM/FM/CD/ AUX Power door locks, Power mirrors, Power windows Air conditioning Auto dimming rearview mirror Steering wheel mounted audio and cruise control Hood visor ONE OWNER. NO ACCIDENTS. TEXT 587.987.3814 for more pictures or a video walk around. Sherwood Certified Pre-Owned (SCP) * 159-pt Sherwood Certified Multi-point inspection. * Free CarFax Verified Report. * Comes with limited power train warranty. * Preferred financing options. * Qualifies to be registered for additional coverage. Why shop at Sherwood Honda? * SERVICE. Google top rated EDM area Honda. * EASY. Experience clear and simple car buying. * CONFIDENCE. 30 Day/1000KM Exchange Privilege. * TRANSPARENT. Breathe easy we dont play pricing games. We have on site authorized banking representatives that can get you preferred rates, preferred terms and faster approvals. Customize your vehicle. We install aftermarket Bluetooth audio, USB/AUX connections, remote starters, heated seats, back up camera's, HID/LED lights. Sherwood Honda 30 Automall Road, Sherwood Park, AB, T8H 2N1 TEXT 587.987.3814 for more pictures or to confirm availability AMVIC licensed Engine: 4 Cylinder Engine 2.0L/122 L/100Km City: 9.0 L/100Km Hwy: 7.3 Mechanical Equipment 120-amp alternator 525 CCA maintenance-free battery Compact spare tire Engine block heater Front wheel drive P215/60R17 all-season touring BSW tires Pwr rack & pinion steering Touring suspension Interior Equipment Air conditioning w/Chill Zone storage Auxiliary 12V & 115V pwr outlets Bright instrument panel switches Driver seat height adjuster Electroluminescent instrument cluster Floor carpeting Fold flat load floor storage Front passenger fold flat seat Full-length floor console Illuminated cupholders Instrument panel cooler Instrument panel w/satin silver bezel, 240-kph speedometer, tachometer Exterior Equipment Black door handles Body-colour bodyside mouldings Body-colour fascias Body-colour liftgate applique Bright grille Halogen headlamps Liftgate door w/fixed glass Non-locking fuel filler cap Pwr mirrors Rear spoiler Safety Equipment Driver & front passenger "Next Generation" multi-stage airbags w/occupant classification system Side window curtain front/rear airbags Single low note horn Factory Options 2.0L DOHC DUAL VVT 16-VALVE I4 ENGINE KIT REF ID: 16198889",https://www.kijiji.ca/v-cars-trucks/edmonton/2007-dodge-caliber-sxt-homelink-fog-one-owner-aux/1420343079
2006,Used,Cadillac,SRX,4dr V6,Wagon,Brown,0,244382,Automatic,Gasoline,4999,true,None,"Here at 780cars, located at 11071 95 street edmonton, alberta, we are pleased to offer this Sand Storm Beige Cadillac SRX! Fully loaded with beige leather interior, heated seats, power seats, memory seat, beautiful panoramic sunroof, good tires and much more! FINANCING AVAILABLE ON OUR WEBSITE @ WWW.780CARS.COM 780-426-2222 OPEN 7 DAYS A WEEK BEST PRICES IN THE CITY! YES WE TAKE TRADES! WE PAY TOP DOLLAR FOR YOUR TRADE. YES WE FINANCE ALL VEHICLES! GOT A JOB NO CREDIT NO DOWN PAYMENT NO PROBLEM! WE CAN HELP CLICK THE CREDIT APPLICATION AND START DRIVING TODAY. EASY FINANCE 0 DOWN PAYMENT STARTING FROM $250+ A MONTH PAYMENT APPLY ONLINE TODAY. LETS BOOK A TEST DRIVE TODAY ! LOOK FOR OUR WEEKLY $5000.00 AND UNDER CASH BLOW OUT SALES SPECIAL ON KIJIJI AT 780CARS. Engine: V6 Cylinder Engine 3.6L/217 L/100Km City: 15.2 L/100Km Hwy: 9.7 Optional Equipment Air conditioning Cruise control Heated Driver Seat Heated mirrors Memory seats Power Mirrors Power driver seat Power steering Power windows Remote Entry ABS Brakes Driver airbag Driver airbag Fog lights Passenger airbag Rear defrost Lateral airbags Stability control Traction control Intermittent wipers AM/FM stereo CD player Bucket seats Child safety locks Climate control Climate control Front floor mats Mechanical Equipment 3.6L VVT SFI V6 engine 75.8 litre fuel capacity Battery run-down protection Dual stainless steel exhaust w/bright tips Engine block heater w/thermostatically-controlled cord set Engine oil cooler Mobil 1 synthetic oil P235/65HR17 front & P255/60HR17 rear BSW tires Variable speed-sensitive pwr steering Interior Equipment (3) auxiliary pwr outlets 2-driver programmable personalization-inc: driver name, twilight delay, remote-activated verification perimeter lighting, auto door lock mode, delayed door locking, all passengers window lockout, enhanced chime volume, automatic recall of radio & HVAC settings 3-spoke leather-wrapped steering wheel w/manual tilt AM/FM diversity antenna located in rear fixed quarter glass Ashtrays in front console (w/lighter) & rear doors Auto-dimming rearview mirror w/OnStar & compass Communications & GPS antenna on roof Cruise control w/stalk-mounted controls Delphi 7-speaker system Driver information centre (DIC) integrated in radio display Driver/front passenger illuminated visor mirrors Exterior Equipment Fog lights w/integrated turn signals Front license plate frame Pwr-operated rear liftgate Roof side rails Solar-Ray tinted glass w/privacy tint on rear doors, rear quarters & liftgate Tungsten halogen headlamps w/Twilight Sentinel, wiper-activation, automatic light control, flash-to-pass Variable-intermittent wipers w/hood-mounted washers Safety Equipment 3-point seat belts for all positions Child seat anchors-inc: (3) 2nd row integrated top tethers, lower child seat LATCH system Child security rear door locks Driver & front passenger frontal air bags w/dual-stage deployment Driver & front passenger seat-mounted side air bags Front/rear roof-mounted head-curtain air bags w/rollover sensing Factory Options 3.6L VVT SFI V6 ENGINE KIT REF ID: 16264152",https://www.kijiji.ca/v-cars-trucks/edmonton/2006-cadillac-srx-4dr-v6-7-seater-fully-loaded/1421003188
2003,Used,Ford,Focus,SE,Wagon,Grey,0,102540,Automatic,Gasoline,3250,true,None,"ALL vehicles INSPECTED and DETAILED. ALL vehicles come with a Mechanical Fitness Assessment. FINANCING available (on select vehicles). FREE 3 MONTH WARRANTY. TRADES WELCOME. REMOTE START READY. DEALERS and WHOLESALERS welcome! --- Please call us, or visit 104 Street + 78 Avenue. THANK YOU for your interest. We appreciate your business! --- PHONE: 780-433-2517 EMAIL: sales@eurosportauto.ca WEB: eurosportauto.ca --- Euro Sport Auto Sales Ltd. is an AMVIC (Alberta Motor Vehicle Industry Council) Licensed Dealer...... Engine: 4 Cylinder Engine 2.0L/122 Mechanical Equipment 14" steel wheels w/bolt-on wheel covers 50 litre fuel tank Battery saver (interior lights switch off after 20-minutes) Compact spare wheel/tire Electronic engine controls (EEC-V, OBD II) Electronic ignition Engine block heater Front stabilizer bar Front wheel drive Independent control blade SLA rear suspension Interior Equipment 12-volt auxiliary pwr point 60/40 split-fold rear seatback w/flip-up seat cushion Air conditioning Cargo area cover Door trim-inc: soft feel vinyl door trim, armrest, front integral map pocket/speaker grille & door pull handles Dual vanity mirrors w/covers Front centre armrest w/storage Front courtesy light w/theatre dimming Front/rear floor mats Front/rear grab handles Exterior Equipment 2-speed variable-intermittent windshield wipers Black decklid handle Black door handles Black dual manual remote outside mirrors Body-colour body-side protection mouldings Body-colour front/rear bumpers (front 8-KPH impact-absorbing) Colour-keyed rocker panel & lower bumper Luggage rack Rear window wiper/washer Solar tinted glass Safety Equipment 3-point front seat belts w/pretensioners & adjustable D-rings 3-point rear seat belts for all seating positions 8-KPH impact-absorbing front bumper Child safety rear door locks Driver & front passenger second generation airbag Lower Anchors and Tethers for Children (LATCH) in rear outboard seating positions Single note horn KIT REF ID: 17344064",https://www.kijiji.ca/v-cars-trucks/edmonton/2003-ford-focus-se/1433129816
